[
  {
    "id": "schema.valid-contract",
    "targetSchema": "https://covenant-timeline.org/schemas/v0alpha1/contract.schema.json",
    "requirements": ["CTL-CORE-001", "CTL-CONTRACT-001"],
    "document": {
      "schema": "covenant.timeline.contract.v0alpha1",
      "id": "software.release.v0",
      "subject": {
        "kind": "repository",
        "id": "example/service"
      },
      "checkpoints": [
        {
          "id": "release-ready",
          "requirements": ["ci.tests.pass", "review.approved"],
          "onAccept": {
            "kind": "covenant.capability.request",
            "payloadRef": "release.deploy"
          }
        }
      ]
    },
    "expect": {
      "valid": true
    }
  },
  {
    "id": "schema.invalid-version",
    "targetSchema": "https://covenant-timeline.org/schemas/v0alpha1/contract.schema.json",
    "requirements": ["CTL-CORE-001"],
    "document": {
      "schema": "covenant.timeline.contract.v1",
      "id": "software.release.v0",
      "subject": {
        "kind": "repository",
        "id": "example/service"
      },
      "checkpoints": [
        {
          "id": "release-ready",
          "requirements": ["ci.tests.pass"]
        }
      ]
    },
    "expect": {
      "valid": false,
      "errorCode": "schema.invalid"
    }
  },
  {
    "id": "schema.unknown-core-field",
    "targetSchema": "https://covenant-timeline.org/schemas/v0alpha1/contract.schema.json",
    "requirements": ["CTL-CORE-002"],
    "document": {
      "schema": "covenant.timeline.contract.v0alpha1",
      "id": "software.release.v0",
      "subject": {
        "kind": "repository",
        "id": "example/service"
      },
      "checkpoints": [
        {
          "id": "release-ready",
          "requirements": ["ci.tests.pass"]
        }
      ],
      "ambientPolicy": "latest"
    },
    "expect": {
      "valid": false,
      "errorCode": "schema.invalid"
    }
  },
  {
    "id": "schema.empty-checkpoints",
    "targetSchema": "https://covenant-timeline.org/schemas/v0alpha1/contract.schema.json",
    "requirements": ["CTL-CONTRACT-001"],
    "document": {
      "schema": "covenant.timeline.contract.v0alpha1",
      "id": "software.release.v0",
      "subject": {
        "kind": "repository",
        "id": "example/service"
      },
      "checkpoints": []
    },
    "expect": {
      "valid": false,
      "errorCode": "schema.invalid"
    }
  },
  {
    "id": "semantic.duplicate-checkpoint",
    "targetSchema": "https://covenant-timeline.org/schemas/v0alpha1/contract.schema.json",
    "requirements": ["CTL-CONTRACT-001"],
    "semanticCheck": "duplicate-checkpoints",
    "document": {
      "schema": "covenant.timeline.contract.v0alpha1",
      "id": "software.release.v0",
      "subject": {
        "kind": "repository",
        "id": "example/service"
      },
      "checkpoints": [
        {
          "id": "release-ready",
          "requirements": ["ci.tests.pass"]
        },
        {
          "id": "release-ready",
          "requirements": ["review.approved"]
        }
      ]
    },
    "expect": {
      "valid": false,
      "errorCode": "timeline.contract.duplicate_checkpoint"
    }
  },
  {
    "id": "schema.valid-evidence",
    "targetSchema": "https://covenant-timeline.org/schemas/v0alpha1/evidence.schema.json",
    "requirements": ["CTL-EVID-001"],
    "document": {
      "id": "ci-42",
      "kind": "ci",
      "claims": ["ci.tests.pass"],
      "payloadDigest": "sha256:aaaaaaaaaaaaaaaaaaaaaaaaaaaaaaaaaaaaaaaaaaaaaaaaaaaaaaaaaaaaaaaa",
      "producer": "github-actions"
    },
    "expect": {
      "valid": true
    }
  },
  {
    "id": "schema.evidence-missing-digest",
    "targetSchema": "https://covenant-timeline.org/schemas/v0alpha1/evidence.schema.json",
    "requirements": ["CTL-EVID-001"],
    "document": {
      "id": "ci-42",
      "kind": "ci",
      "claims": ["ci.tests.pass"],
      "producer": "github-actions"
    },
    "expect": {
      "valid": false,
      "errorCode": "schema.invalid"
    }
  },
  {
    "id": "schema.evidence-empty-claims",
    "targetSchema": "https://covenant-timeline.org/schemas/v0alpha1/evidence.schema.json",
    "requirements": ["CTL-EVID-001"],
    "document": {
      "id": "ci-42",
      "kind": "ci",
      "claims": [],
      "payloadDigest": "sha256:aaaaaaaaaaaaaaaaaaaaaaaaaaaaaaaaaaaaaaaaaaaaaaaaaaaaaaaaaaaaaaaa",
      "producer": "github-actions"
    },
    "expect": {
      "valid": false,
      "errorCode": "schema.invalid"
    }
  },
  {
    "id": "schema.valid-evidence-event",
    "targetSchema": "https://covenant-timeline.org/schemas/v0alpha1/event.schema.json",
    "requirements": ["CTL-CORE-001", "CTL-EVENT-001"],
    "document": {
      "schema": "covenant.timeline.event.v0alpha1",
      "id": "event-0",
      "sequence": 0,
      "type": "evidence.recorded",
      "evidence": {
        "id": "ci-42",
        "kind": "ci",
        "claims": ["ci.tests.pass"],
        "payloadDigest": "sha256:aaaaaaaaaaaaaaaaaaaaaaaaaaaaaaaaaaaaaaaaaaaaaaaaaaaaaaaaaaaaaaaa",
        "producer": "github-actions"
      }
    },
    "expect": {
      "valid": true
    }
  },
  {
    "id": "schema.event-missing-sequence",
    "targetSchema": "https://covenant-timeline.org/schemas/v0alpha1/event.schema.json",
    "requirements": ["CTL-EVENT-001"],
    "document": {
      "schema": "covenant.timeline.event.v0alpha1",
      "id": "event-0",
      "type": "evidence.recorded",
      "evidence": {
        "id": "ci-42",
        "kind": "ci",
        "claims": ["ci.tests.pass"],
        "payloadDigest": "sha256:aaaaaaaaaaaaaaaaaaaaaaaaaaaaaaaaaaaaaaaaaaaaaaaaaaaaaaaaaaaaaaaa",
        "producer": "github-actions"
      }
    },
    "expect": {
      "valid": false,
      "errorCode": "schema.invalid"
    }
  },
  {
    "id": "schema.event-mixed-variant-fields",
    "targetSchema": "https://covenant-timeline.org/schemas/v0alpha1/event.schema.json",
    "requirements": ["CTL-CORE-002", "CTL-EVENT-001"],
    "document": {
      "schema": "covenant.timeline.event.v0alpha1",
      "id": "event-0",
      "sequence": 0,
      "type": "evidence.recorded",
      "evidence": {
        "id": "ci-42",
        "kind": "ci",
        "claims": ["ci.tests.pass"],
        "payloadDigest": "sha256:aaaaaaaaaaaaaaaaaaaaaaaaaaaaaaaaaaaaaaaaaaaaaaaaaaaaaaaaaaaaaaaa",
        "producer": "github-actions"
      },
      "checkpointId": "release-ready"
    },
    "expect": {
      "valid": false,
      "errorCode": "schema.invalid"
    }
  },
  {
    "id": "schema.valid-decision",
    "targetSchema": "https://covenant-timeline.org/schemas/v0alpha1/decision.schema.json",
    "requirements": ["CTL-DECISION-001"],
    "document": {
      "schema": "covenant.timeline.decision.v0alpha1",
      "checkpointId": "release-ready",
      "outcome": "accepted",
      "policyRef": "software.release.v0",
      "evidenceRefs": ["ci-42"],
      "missingRequirements": []
    },
    "expect": {
      "valid": true
    }
  },
  {
    "id": "schema.decision-missing-policy",
    "targetSchema": "https://covenant-timeline.org/schemas/v0alpha1/decision.schema.json",
    "requirements": ["CTL-DECISION-001"],
    "document": {
      "schema": "covenant.timeline.decision.v0alpha1",
      "checkpointId": "release-ready",
      "outcome": "rejected",
      "evidenceRefs": [],
      "missingRequirements": ["ci.tests.pass"]
    },
    "expect": {
      "valid": false,
      "errorCode": "schema.invalid"
    }
  },
  {
    "id": "schema.valid-command",
    "targetSchema": "https://covenant-timeline.org/schemas/v0alpha1/command.schema.json",
    "requirements": ["CTL-EFFECT-001"],
    "document": {
      "schema": "covenant.timeline.command.v0alpha1",
      "id": "run-42:release-ready:2",
      "kind": "covenant.capability.request",
      "payloadRef": "release.deploy",
      "idempotencyKey": "run-42/release-ready/2",
      "replayPolicy": "forbid"
    },
    "expect": {
      "valid": true
    }
  },
  {
    "id": "schema.command-missing-idempotency",
    "targetSchema": "https://covenant-timeline.org/schemas/v0alpha1/command.schema.json",
    "requirements": ["CTL-EFFECT-001"],
    "document": {
      "schema": "covenant.timeline.command.v0alpha1",
      "id": "run-42:release-ready:2",
      "kind": "covenant.capability.request",
      "payloadRef": "release.deploy",
      "replayPolicy": "forbid"
    },
    "expect": {
      "valid": false,
      "errorCode": "schema.invalid"
    }
  },
  {
    "id": "schema.command-replay-allowed",
    "targetSchema": "https://covenant-timeline.org/schemas/v0alpha1/command.schema.json",
    "requirements": ["CTL-EFFECT-001"],
    "document": {
      "schema": "covenant.timeline.command.v0alpha1",
      "id": "run-42:release-ready:2",
      "kind": "covenant.capability.request",
      "payloadRef": "release.deploy",
      "idempotencyKey": "run-42/release-ready/2",
      "replayPolicy": "allow"
    },
    "expect": {
      "valid": false,
      "errorCode": "schema.invalid"
    }
  },
  {
    "id": "schema.valid-receipt",
    "targetSchema": "https://covenant-timeline.org/schemas/v0alpha1/receipt.schema.json",
    "requirements": ["CTL-RECEIPT-001"],
    "document": {
      "id": "receipt-42",
      "commandId": "run-42:release-ready:2",
      "status": "succeeded",
      "effectDigest": "sha256:bbbbbbbbbbbbbbbbbbbbbbbbbbbbbbbbbbbbbbbbbbbbbbbbbbbbbbbbbbbbbbbb"
    },
    "expect": {
      "valid": true
    }
  },
  {
    "id": "schema.receipt-missing-command",
    "targetSchema": "https://covenant-timeline.org/schemas/v0alpha1/receipt.schema.json",
    "requirements": ["CTL-RECEIPT-001"],
    "document": {
      "id": "receipt-42",
      "status": "succeeded",
      "effectDigest": "sha256:bbbbbbbbbbbbbbbbbbbbbbbbbbbbbbbbbbbbbbbbbbbbbbbbbbbbbbbbbbbbbbbb"
    },
    "expect": {
      "valid": false,
      "errorCode": "schema.invalid"
    }
  },
  {
    "id": "semantic.unknown-required-extension",